{
  "schemaVersion": "joint-tennis-tournament.v1",
  "tournament": {
    "tournamentId": "tournament:tennis:joint:cincinnati-open:2026",
    "name": "Cincinnati Open",
    "season": 2026,
    "sportId": "sport:tennis",
    "representedTours": [
      "ATP",
      "WTA"
    ],
    "venue": "Lindner Family Tennis Center",
    "location": "Mason, Ohio, USA",
    "timezone": "America/New_York",
    "startDate": "2026-08-08",
    "endDate": "2026-08-23"
  },
  "retrievedAt": "2026-08-14T06:25:39.352Z",
  "freshness": {
    "confidence": "Provisional",
    "mode": "schedule",
    "lastSuccessfulAt": "2026-08-14T06:25:39.352Z",
    "staleAfterHours": 24
  },
  "sourcePages": [
    "https://cincinnatiopen.com/tournament/tournament-schedule/",
    "https://cincinnatiopen.com/score-center/order-of-play/",
    "https://cincinnatiopen.com/score-center/draws/"
  ],
  "sourceDocuments": [
    {
      "kind": "order_of_play",
      "publisherPageUrl": "https://cincinnatiopen.com/score-center/order-of-play/",
      "sourceUrl": "https://cincinnatiopen.com/wp-content/uploads/2026/08/OP-Aug-13-524p.pdf",
      "retrievedAt": "2026-08-14T06:25:39.352Z",
      "sha256": "fda44794a5284cbd6b9f487ea8d7c29895dc23a361994203d3f8664f831e4b46"
    },
    {
      "kind": "draws",
      "publisherPageUrl": "https://cincinnatiopen.com/score-center/draws/",
      "sourceUrl": "https://cincinnatiopen.com/wp-content/uploads/2026/08/MDS-ATP-Aug-13-530pm.pdf",
      "retrievedAt": "2026-08-14T06:25:39.352Z"
    }
  ],
  "schedule": {
    "date": "2026-08-14",
    "displayMessage": "Beta schedule",
    "matches": [
      {
        "tour": "WTA",
        "round": "unknown",
        "players": [
          {
            "playerId": "competitor:tennis:wta:sara-bejlek",
            "name": "Sara Bejlek",
            "ranking": 38,
            "nationalityCode": "CZE",
            "isAustralian": false
          },
          {
            "playerId": "competitor:tennis:wta:karolina-pliskova",
            "name": "Karolina PLISKOVA",
            "ranking": null,
            "nationalityCode": "CZE",
            "isAustralian": false
          }
        ],
        "venue": "Lindner Family Tennis Center",
        "court": "P&G STADIUM COURT",
        "courtSequence": 1,
        "scheduledSequence": 1,
        "timing": {
          "type": "exact",
          "label": "11:00 AM",
          "localTime": "11:00"
        },
        "narrativeSignals": [],
        "matchId": "match:tennis:tournament-tennis-joint-cincinnati-open-2026:wta:competitor-tennis-wta-karolina-pliskova--competitor-tennis-wta-sara-bejlek",
        "scheduleDate": "2026-08-14",
        "scheduledAtUtc": "2026-08-14T15:00:00.000Z",
        "selection": {
          "score": 18.19,
          "components": {
            "roundImportance": 6,
            "playerRankings": 12.19,
            "australianInterest": 0,
            "narrative": 0
          },
          "reasons": [
            "unknown importance",
            "player rankings"
          ]
        }
      },
      {
        "tour": "ATP",
        "round": "unknown",
        "players": [
          {
            "playerId": "competitor:tennis:atp:valentin-royer",
            "name": "Valentin ROYER",
            "ranking": null,
            "nationalityCode": "FRA",
            "isAustralian": false
          },
          {
            "playerId": "competitor:tennis:atp:stefanos-tsitsipas",
            "name": "Stefanos TSITSIPAS",
            "ranking": null,
            "nationalityCode": "GRE",
            "isAustralian": false
          }
        ],
        "venue": "Lindner Family Tennis Center",
        "court": "GRANDSTAND",
        "courtSequence": 1,
        "scheduledSequence": 2,
        "timing": {
          "type": "exact",
          "label": "11:00 AM",
          "localTime": "11:00"
        },
        "narrativeSignals": [],
        "matchId": "match:tennis:tournament-tennis-joint-cincinnati-open-2026:atp:competitor-tennis-atp-stefanos-tsitsipas--competitor-tennis-atp-valentin-royer",
        "scheduleDate": "2026-08-14",
        "scheduledAtUtc": "2026-08-14T15:00:00.000Z",
        "selection": {
          "score": 10,
          "components": {
            "roundImportance": 6,
            "playerRankings": 4,
            "australianInterest": 0,
            "narrative": 0
          },
          "reasons": [
            "unknown importance"
          ]
        }
      },
      {
        "tour": "ATP",
        "round": "unknown",
        "players": [
          {
            "playerId": "competitor:tennis:atp:sho-shimabukuro",
            "name": "Sho SHIMABUKURO",
            "ranking": null,
            "nationalityCode": "JPN",
            "isAustralian": false
          },
          {
            "playerId": "competitor:tennis:atp:hubert-hurkacz",
            "name": "Hubert HURKACZ",
            "ranking": null,
            "nationalityCode": "POL",
            "isAustralian": false
          }
        ],
        "venue": "Lindner Family Tennis Center",
        "court": "TONY TRABERT STADIUM 3",
        "courtSequence": 1,
        "scheduledSequence": 3,
        "timing": {
          "type": "exact",
          "label": "11:00 AM",
          "localTime": "11:00"
        },
        "narrativeSignals": [],
        "matchId": "match:tennis:tournament-tennis-joint-cincinnati-open-2026:atp:competitor-tennis-atp-hubert-hurkacz--competitor-tennis-atp-sho-shimabukuro",
        "scheduleDate": "2026-08-14",
        "scheduledAtUtc": "2026-08-14T15:00:00.000Z",
        "selection": {
          "score": 10,
          "components": {
            "roundImportance": 6,
            "playerRankings": 4,
            "australianInterest": 0,
            "narrative": 0
          },
          "reasons": [
            "unknown importance"
          ]
        }
      },
      {
        "tour": "WTA",
        "round": "unknown",
        "players": [
          {
            "playerId": "competitor:tennis:wta:jessica-bouzas-maneiro",
            "name": "Jessica BOUZAS MANEIRO",
            "ranking": null,
            "nationalityCode": "ESP",
            "isAustralian": false
          },
          {
            "playerId": "competitor:tennis:wta:anna-bondar",
            "name": "Anna BONDAR",
            "ranking": null,
            "nationalityCode": "HUN",
            "isAustralian": false
          }
        ],
        "venue": "Lindner Family Tennis Center",
        "court": "CHAMPIONS' COURT",
        "courtSequence": 1,
        "scheduledSequence": 4,
        "timing": {
          "type": "exact",
          "label": "11:00 AM",
          "localTime": "11:00"
        },
        "narrativeSignals": [],
        "matchId": "match:tennis:tournament-tennis-joint-cincinnati-open-2026:wta:competitor-tennis-wta-anna-bondar--competitor-tennis-wta-jessica-bouzas-maneiro",
        "scheduleDate": "2026-08-14",
        "scheduledAtUtc": "2026-08-14T15:00:00.000Z",
        "selection": {
          "score": 10,
          "components": {
            "roundImportance": 6,
            "playerRankings": 4,
            "australianInterest": 0,
            "narrative": 0
          },
          "reasons": [
            "unknown importance"
          ]
        }
      },
      {
        "tour": "WTA",
        "round": "unknown",
        "players": [
          {
            "playerId": "competitor:tennis:wta:nikola-bartunkova",
            "name": "Nikola Bartunkova",
            "ranking": 42,
            "nationalityCode": "CZE",
            "isAustralian": false
          },
          {
            "playerId": "competitor:tennis:wta:alina-charaeva",
            "name": "Alina CHARAEVA",
            "ranking": null,
            "nationalityCode": "ARM",
            "isAustralian": false
          }
        ],
        "venue": "Lindner Family Tennis Center",
        "court": "COURT 10",
        "courtSequence": 1,
        "scheduledSequence": 5,
        "timing": {
          "type": "exact",
          "label": "11:00 AM",
          "localTime": "11:00"
        },
        "narrativeSignals": [],
        "matchId": "match:tennis:tournament-tennis-joint-cincinnati-open-2026:wta:competitor-tennis-wta-alina-charaeva--competitor-tennis-wta-nikola-bartunkova",
        "scheduleDate": "2026-08-14",
        "scheduledAtUtc": "2026-08-14T15:00:00.000Z",
        "selection": {
          "score": 17.67,
          "components": {
            "roundImportance": 6,
            "playerRankings": 11.67,
            "australianInterest": 0,
            "narrative": 0
          },
          "reasons": [
            "unknown importance",
            "player rankings"
          ]
        }
      },
      {
        "tour": "WTA",
        "round": "unknown",
        "players": [
          {
            "playerId": "competitor:tennis:wta:elisabetta-cocciaretto",
            "name": "Elisabetta COCCIARETTO",
            "ranking": null,
            "nationalityCode": "ITA",
            "isAustralian": false
          },
          {
            "playerId": "competitor:tennis:wta:lucrezia-stefanini",
            "name": "Lucrezia STEFANINI",
            "ranking": null,
            "nationalityCode": "ITA",
            "isAustralian": false
          }
        ],
        "venue": "Lindner Family Tennis Center",
        "court": "COURT 4",
        "courtSequence": 1,
        "scheduledSequence": 6,
        "timing": {
          "type": "exact",
          "label": "11:00 AM",
          "localTime": "11:00"
        },
        "narrativeSignals": [],
        "matchId": "match:tennis:tournament-tennis-joint-cincinnati-open-2026:wta:competitor-tennis-wta-elisabetta-cocciaretto--competitor-tennis-wta-lucrezia-stefanini",
        "scheduleDate": "2026-08-14",
        "scheduledAtUtc": "2026-08-14T15:00:00.000Z",
        "selection": {
          "score": 10,
          "components": {
            "roundImportance": 6,
            "playerRankings": 4,
            "australianInterest": 0,